title,content,post_date,url
Online výuka bez kompromisů. Online Střední škola Spektrum potvrdila svou kvalitu maturitními výsledky ​,,,https://www.moore-czech.cz/tiskove-zpravy/cerven-2025/online-stredni-skola
"Vysoké nároky, celoživotní vzdělávání i zapojení AI. Podoba moderního účetnictví se prudce mění",,,https://www.moore-czech.cz/tiskove-zpravy/cerven-2025/podoba-moderniho-ucetnictvi
Digitální škola patří mezi nejlepší v regionu. Umožňuje studium i profesionálním sportovcům,,,https://www.moore-czech.cz/tiskove-zpravy/kveten-2025/digitalni-skola-patri-mezi-nejlepsi-v-regionu
Energetika stále čelí řadě nejistot. Přechod na obnovitelné zdroje brzdí poplatky i infrastruktura,,,https://www.moore-czech.cz/tiskove-zpravy/duben-2025/energetika-stale-celi-rade-nejistot
Vztah mezi klientem a finanční institucí posilují digitální procesy i digitální peníze,,,https://www.moore-czech.cz/tiskove-zpravy/duben-2025/vztah-mezi-klientem-a-financni-instituci
Talk2amy vstupuje do nové éry díky strategickému partnerství s Moore Czech Republic,,,https://www.moore-czech.cz/tiskove-zpravy/duben-2025/talk2amy-vstupuje-do-nove-ery
"Firmy v roce 2025 čekají další daňové změny, stavebnictví nebude výjimkou",,,https://www.moore-czech.cz/tiskove-zpravy/brezen-2025/danove-zmeny-2025
Home-office proměnil trh práce. Zůstane i nadále běžnou praxí?,,,https://www.moore-czech.cz/tiskove-zpravy/unor-2025/home-office-promenil-trh-prace-zustane-i-nadale-be
Skupina ANACOT CAPITAL opět rozšiřuje své působení. Do svého portfolia získala blanenského výrobce pistolí Laugo Arms Czechoslovakia,,,https://www.moore-czech.cz/tiskove-zpravy/leden-2025/skupina-anacot-capital-opet-rozsiruje
Skupina Moore Czech Republic expanduje na Slovensko v oblasti poradenských služeb,,,https://www.moore-czech.cz/tiskove-zpravy/prosinec-2024/skupina-moore-czech-republic-expanduje
Zůstat efektivní a nezbláznit se. Moore Czech Republic se připojuje ke světové iniciativě usilující o snižování stresu na pracovišti,,,https://www.moore-czech.cz/tiskove-zpravy/prosinec-2024/zustat-efektivni-a-nezblaznit-se
"Rekvalifikace jako výtah do vyšších pater profesních i mzdových. Zájem roste, podpora nikoli",,,https://www.moore-czech.cz/tiskove-zpravy/prosinec-2024/rekvalifikace-jako-vytah-do-vyssich-pater
ESG reportování podléhá novým pravidlům. Jeho podobu bude od nového roku udávat směrnice CSRD,,,https://www.moore-czech.cz/tiskove-zpravy/prosinec-2024/esg-reportovani-podleha-novym-pravidlum
Skupina Moore Czech Republic opět rozšiřuje své působení – vstoupila do společností PP Business Services a AK AUDIT,,,https://www.moore-czech.cz/tiskove-zpravy/listopad-2024/moore-czech-republic-rozisiruje-pole-pusobnosti
NIS2 jako velká neznámá. Povědomí o klíčové směrnici pro kyberbezpečnost má jen málokdo,,,https://www.moore-czech.cz/tiskove-zpravy/listopad-2024/nis2-jako-velka-neznama
Firmy vstupují do nové éry povinného ESG reportingu. Důvodem je směrnice CSRD,,,https://www.moore-czech.cz/tiskove-zpravy/rijen-2024/firmy-vstupuji-do-nove-ery-povinneho-esg
Novela zákona o DPH: Příslib zjednodušení provázejí obavy z nadměrného papírování,,,https://www.moore-czech.cz/tiskove-zpravy/srpen-2024/novela-zakona-o-dph
Změny v DPP a DPČ mohou mít negativní dopad na flexibilitu zaměstnávání v Česku,,,https://www.moore-czech.cz/tiskove-zpravy/cervenec-2024/zmeny-v-dpp-a-dpc
Udržitelnost energetických firem začíná z pohledu investorů hrát prim,,,https://www.moore-czech.cz/tiskove-zpravy/cerven-2024/udrzitelnost-energetickych-firem
I přes výrazný růst cen nemovitostí  realitní bublina v ČR nehrozí,,,https://www.moore-czech.cz/tiskove-zpravy/cerven-2024/tz-ceny-nemovitosti
Ekonomická analýza Moore Czech Republic potvrdila výhodnost investice do lanovky na Ještěd,,,https://www.moore-czech.cz/tiskove-zpravy/kveten-2024/ekonomicka-analyza-lanovka-jested
Hotelnictví: Check-in do roku růstu a digitálních změn V České republice je největší problém krátká doba pobytů turistů,,,https://www.moore-czech.cz/tiskove-zpravy/kveten-2024/hotelnictvi-check-in
"Bez ohledu na nedostatek zaměstnanců, Češi nad 55 let si myslí, že najít práci je kvůli věku problém",,,https://www.moore-czech.cz/tiskove-zpravy/kveten-2024/prace-cesi-nad-55
Sophiina volba dodavatelů automobilek,,,https://www.moore-czech.cz/tiskove-zpravy/brezen-2024/sophiina-volba-dodavatelu-automobilek
Čtvrtá průmyslová revoluce teprve začíná,,,https://www.moore-czech.cz/tiskove-zpravy/brezen-2024/ctvrta-prumyslova-revoluce-teprve-zacina
"Technologie ve financích výrazně zrychlují, hlavní roli hraje umělá inteligence",,,https://www.moore-czech.cz/tiskove-zpravy/unor-2024/technologie-ve-financich-vyrazne-zrychluji
Komunitní energetika může změnit Česko,,,https://www.moore-czech.cz/tiskove-zpravy/leden-2024/komunitni-energetika-muze-zmenit-cesko
Hybridní práce zvyšuje produktivitu firem,,,https://www.moore-czech.cz/tiskove-zpravy/leden-2024/hybridni-prace-zvysuje-produktivitu-firem
Zvýšení daní pro firmy a změny ve výhodách pro rodiny: Co nás čeká v novém roce 2024,,,https://www.moore-czech.cz/tiskove-zpravy/prosinec-2023/zvyseni-dani-pro-firmy-a-zmeny-ve-vyhodach
Přínosy umělé inteligence pro byznys rostou a spolu s tím také investice do ní,,,https://www.moore-czech.cz/tiskove-zpravy/prosinec-2023/prinosy-umele-inteligence-pro-byznys
Ochrana oznamovatelů: 42 % zaměstnanců se obává odvetných opatření,,,https://www.moore-czech.cz/tiskove-zpravy/prosinec-2023/ochrana-oznamovatelu-42-zamestnancu-se-obava-odvet
Analýza MOORE CZ: pobytové sociální služby by měly více dbát na požární ochranu,,,https://www.moore-czech.cz/tiskove-zpravy/listopad-2023/pobytove-socialni-sluzby-pozarni-ochrana
Udržitelnost jako klíč k vyšším tržbám a udržení zaměstnanců,,,https://www.moore-czech.cz/tiskove-zpravy/listopad-2023/udrzitelnost-jako-klic-k-vyssim-trzbam
"8 z 10 rodičů by se vrátilo dříve do práce, kdyby jejich zaměstnavatel poskytoval firemní školku či dětskou skupinu",,,https://www.moore-czech.cz/tiskove-zpravy/rijen-2023/8-z-10-rodicu-by-se-vratilo-drive-do-prace
První postřehy implementace zákona o ochraně oznamovatelů: zaskočené školy a přešlapující malé firmy,,,https://www.moore-czech.cz/tiskove-zpravy/zari-2023/zakon-o-ochrane-oznamovatele
Blockhain mění finanční služby. Rychlejší a levnější platby jsou ale energeticky náročné,,,https://www.moore-czech.cz/tiskove-zpravy/srpen-2023/blockhain
"Nezaměstnanost je nízká, ale česká ekonomika strádá. Proč potřebujeme cizince a flexibilní pracovní podmínky?",,,https://www.moore-czech.cz/tiskove-zpravy/srpen-2023/nezamestnanost-je-nizka-ale
"Umělá inteligence zvýší kvalitu a efektivitu právních služeb, je ovšem potřeba dbát na ochranu dat",,,https://www.moore-czech.cz/tiskove-zpravy/srpen-2023/umela-inteligence-zvysi-kvalitu-a-efektivitu
"Český trh fúzí a akvizic po útlumu opět nabírá dech, investory po období krizí zajímá odolnost firem",,,https://www.moore-czech.cz/tiskove-zpravy/cervenec-2023/cesky-trh-fuzi
"Využití umělé inteligence rozhodne o úspěchu ve výrobě a distribuci, investice do ní se v tomto sektoru během čtyř let zdvojnásobí",,,https://www.moore-czech.cz/tiskove-zpravy/cervenec-2023/vyuziti-umele-inteligence
Tři ze čtyř zaměstnanců chtějí čtyřdenní pracovní týden. Zájem je vyšší než před dvěma roky,,,https://www.moore-czech.cz/tiskove-zpravy/cervenec-2023/ctyrdenni-pracovni-tyden
"Umělá inteligence nevezme lidem práci, ale zefektivní ji. Pomůže například při náborovém procesu",,,https://www.moore-czech.cz/tiskove-zpravy/cerven-2023/umela-inteligence-nevezme-lidem-praci
Zdanění nefinančních benefitů způsobí tlak na růst mezd. Stíží také firmám nábor,,,https://www.moore-czech.cz/tiskove-zpravy/cerven-2023/zdaneni-nefinancnich-benefitu
Moore Advisory CZ: stát může úpravou plateb za pobyt v pobytových zařízeních sociálních služeb ušetřit až 337 milionů ročně,,,https://www.moore-czech.cz/tiskove-zpravy/cerven-2023/moore-advisory-cz-stat-muze-usetrit
"Skupina Moore koupila střední školu, navazuje na trend spolupráce zaměstnavatelů se školami",,,"https://www.moore-czech.cz/tiskove-zpravy/cerven-2023/skupina-moore-koupila-stredni-skolu,-navazuje-na-t"
"Hlavní trendy ve finančnictví – digitalizace, AI a udržitelnost",,,https://www.moore-czech.cz/tiskove-zpravy/kveten-2023/hlavni-trendy-ve-financnictvi
"Národní soustava kvalifikací pomáhá těm, kdo chtějí lepší práci.  Povědomí o ní stoupá",,,https://www.moore-czech.cz/tiskove-zpravy/kveten-2023/narodni-soustava-kvalifikaci
"Cestovní ruch se loni zotavil z Covidu, letos poroste. Posílí hlavně zavedené značky",,,https://www.moore-czech.cz/tiskove-zpravy/kveten-2023/cestovni-ruch
Oznamovatelé ušetří firmám peníze a zlepší firemní kulturu. Oznamovací systém je ale potřeba budovat již nyní,,,https://www.moore-czech.cz/tiskove-zpravy/kveten-2023/oznamovatele-usetri-firmam-penize
Big data umožní optimalizaci výroby elektřiny. Novým trendem budou komunitní elektrárny,,,https://www.moore-czech.cz/tiskove-zpravy/kveten-2023/big-data-umozni-optimalizaci-vyroby-elektriny
,,,https://www.moore-czech.cz/tiskove-zpravy/brezen-2023/pavel-drobil-se-stava-novym-partnerem-v-poradenske
Virtuální elektrárny promění trh s energiemi. V budoucnu mohou v Česku produkovat až 25 % elektřiny,,,https://www.moore-czech.cz/tiskove-zpravy/brezen-2023/virtualni-elektrarny
Budoucností jsou zelená města. Praha ve srovnání s ostatními evropskými metropolemi zaostává,,,https://www.moore-czech.cz/tiskove-zpravy/brezen-2023/budoucnosti-jsou-zelena-mesta
"Patříte mezi 80 % těch, kteří dosud nepodali daňové přiznání? Máte ještě více než 2 týdny, ale mohou to být také skoro 4 měsíce",,,https://www.moore-czech.cz/tiskove-zpravy/brezen-2023/danove-priznani-2022
Důsledek ruské agrese. Podíl Ruska na celkovém vývozu z EU klesl od loňského února o víc než polovinu,,,https://www.moore-czech.cz/tiskove-zpravy/unor-2023/dusledek-ruske-agrese
Firmy stále více spolupracují se školami. Vychovávají si tak budoucí zaměstnance,,,https://www.moore-czech.cz/tiskove-zpravy/unor-2023/firmy-stale-vice-spolupracuji-se-skolami
Sting nabízí 100%  stipendium a snovou kariéru,,,https://www.moore-czech.cz/tiskove-zpravy/unor-2023/sting-kariera
,,,https://www.moore-czech.cz/tiskove-zpravy/unor-2023/novy-partner
Rok 2021 ve znamení zvýšené spotřeby energie. Česko zaznamenalo 3. nejvyšší nárůst v Unii,,,https://www.moore-czech.cz/tiskove-zpravy/leden-2023/spotreba-energie-cesko
Digitalizace je budoucností finančního sektoru. Česko v ní ovšem zaostává,,,https://www.moore-czech.cz/tiskove-zpravy/leden-2023/digitalizace-je-budoucnosti
"Průzkum mezi OSVČ: Stát jim zřizuje datové schránky, většina z nich s tím počítá",,,https://www.moore-czech.cz/tiskove-zpravy/leden-2023/pruzkum-datove-schranky
Nový systém paušální daně: Překročení limitu o tisíc korun může znamenat navýšení odvodů až o 120 tisíc,,,https://www.moore-czech.cz/tiskove-zpravy/prosinec-2022/pausalni-dane
"Zhoršení financování, omezení investic a propouštění. To vše čeká tuzemské podniky v následujících měsících",,,https://www.moore-czech.cz/tiskove-zpravy/prosinec-2022/zhorseni-financovani
Firmám kladoucím důraz na ESG rostou příjmy dvakrát rychleji. Lépe se daří i jejich akciím,,,https://www.moore-czech.cz/tiskove-zpravy/listopad-2022/esg
Výhoda české ekonomiky: Malé podniky tvoří 35 % přidané hodnoty,,,https://www.moore-czech.cz/tiskove-zpravy/rijen-2022/vyhoda-ceske-ekonomiky
České investice do výzkumu a vývoje zaostávají za průměrem EU,,,https://www.moore-czech.cz/tiskove-zpravy/rijen-2022/ceske-investice-do-vyzkumu
"Skupina Moore Czech Republic opět skokově roste – vstoupila do společností Bene Factum, HZConsult a Audikon",,,https://www.moore-czech.cz/tiskove-zpravy/zari-2022/moore-roste
"ČESKO ZAOSTÁVÁ V UMĚLÉ INTELIGENCI, POUŽÍVAJÍ JI JEN 4 % FIREM",,,https://www.moore-czech.cz/tiskove-zpravy/zari-2022/ai-cesko
Cestovní ruch po dvouletém útlumu ožil. Aktuální hrozbou je ekonomická recese a vysoká míra inflace,,,https://www.moore-czech.cz/tiskove-zpravy/zari-2022/tz_cestovni_ruch
Návrat na předpandemickou úroveň HDP se nedaří. ČR je v rámci EU pátá nejhorší,,,https://www.moore-czech.cz/tiskove-zpravy/srpen-2022/hdp_covid
České samosprávy se učí lépe plánovat. Vzorem je Spojené království,,,https://www.moore-czech.cz/tiskove-zpravy/cervenec-2022/ceske-samospravy-planovani
,,,https://www.moore-czech.cz/tiskove-zpravy/cervenec-2022/servodata_novyreditel
O ESG slyšela jen čtvrtina manažerů. Od příštího roku se bude týkat tisíců firem,,,https://www.moore-czech.cz/tiskove-zpravy/cerven-2022/o_esg
U veřejnosti není o kvóty zájem. Pro jejich zavedení je méně než 25 %,,,https://www.moore-czech.cz/tiskove-zpravy/cerven-2022/kvoty
Na zvýšení minimální mzdy o 2 tisíce není prostor. Firmy přesto připlácí samy od sebe,,,https://www.moore-czech.cz/tiskove-zpravy/cerven-2022/tz_minimalni_mzda
Zrušení EET je krok zpět. Stát by měl podpořit alespoň dobrovolný režim evidence,,,https://www.moore-czech.cz/tiskove-zpravy/cerven-2022/zruseni-eet
Inflace snižuje aktivitu v oblasti fúzí a akvizic. Investoři v nejisté době mění své rozhodování,,,https://www.moore-czech.cz/tiskove-zpravy/cerven-2022/inflace-snizuje-aktivitu-v-oblasti-fuzi-a-akvizic
"Ceny rostou, limit pro DPP ne. Zvýšení by pomohlo ohroženým skupinám a přispělo k flexibilitě pracovního trhu",,,"https://www.moore-czech.cz/tiskove-zpravy/kveten-2022/ceny-rostou,-limit-pro-dpp-ne-zvyseni-by-pomohlo-o"
Česká ochrana klimatu je v rámci Evropské unie pozadu. Železnici ale využíváme nadprůměrně,,,https://www.moore-czech.cz/tiskove-zpravy/kveten-2022/ceska-ochrana-klimatu-je-v-ramci-evropske-unie-poz
MOORE CZECH REPUBLIC ZASTŘEŠUJE POMOC ASIJSKÝM SPOLEČNOSTEM NA EVROPSKÉM TRHU,,,https://www.moore-czech.cz/tiskove-zpravy/duben-2022/tz_moore_asia
Trh marketingových technologií loni celosvětově přesáhl hodnotu 340 miliard dolarů,,,https://www.moore-czech.cz/tiskove-zpravy/duben-2022/trh-marketingovych-technologii-loni-celosvetove-pr
Moore Czech Republic posílila účetní a daňové poradenství. Koupila společnost Alfin,,,https://www.moore-czech.cz/tiskove-zpravy/duben-2022/moore-czech-republic-posilila-ucetni-a-danove-pora
Až 60 % organizací vyžaduje nadbytečný souhlas se zpracováním osobních údajů,,,https://www.moore-czech.cz/tiskove-zpravy/brezen-2022/az-60-organizaci-vyzaduje-nadbytecny-souhlas-se-zp
Českému trhu práce pomůže otevření zahraničním pracovníkům a přijetí systémových změn,,,https://www.moore-czech.cz/tiskove-zpravy/brezen-2022/ceskemu-trhu-prace-pomuze-otevreni-zahranicnim-pra
,,,https://www.moore-czech.cz/tiskove-zpravy/brezen-2022/v-cesku-se-za-minuly-rok-zdvojnasobil-pocet-podnik
Standard zajišťující fungování cílené online reklamy byl v Belgii označen za protiprávní. Dopady mohou nastat i v Česku,,,https://www.moore-czech.cz/tiskove-zpravy/unor-2022/standard-zajistujici-fungovani-cilene-online-rekla
Průzkum kyberbezpečnosti firem: Každá pátá firma čelila útoku. Systematické prevenci se věnuje pouze čtvrtina,,,https://www.moore-czech.cz/tiskove-zpravy/leden-2022/pruzkum-kyberbezpecnosti-firem-kazda-pata-firma-ce
Počet kybernetických útoků se téměř zdvojnásobil. Nejohroženější jsou lidé na homeoffice,,,https://www.moore-czech.cz/tiskove-zpravy/prosinec-2021/pocet-kybernetickych-utoku-se-temer-zdvojnasobil-n
ČR nestihne schválit legislativu k whistleblowingu včas. Některé subjekty přesto musí být připraveny,,,https://www.moore-czech.cz/tiskove-zpravy/prosinec-2021/cr-nestihne-schvalit-legislativu-k-whistleblowingu
Řada organizací stále nemá řádně vyřešeno GDPR. Nejčastější chybou je nadbytečné vyžadování souhlasu,,,https://www.moore-czech.cz/tiskove-zpravy/listopad-2021/rada-organizaci-stale-nema-radne-vyreseno-gdpr-nej
"Vládní investice do výzkumu a vývoje výrazně vzrostly, přesto je ČR za průměrem EU",,,https://www.moore-czech.cz/tiskove-zpravy/listopad-2021/vladni-investice-do-vyzkumu-a-vyvoje-vyrazne-vzros
Úplné zrušení EET nedává smysl. Nabízí se podpořit alespoň dobrovolnou evidenci,,,https://www.moore-czech.cz/tiskove-zpravy/listopad-2021/uplne-zruseni-eet-nedava-smysl-nabizi-se-podporit
9 z 10 ICT profesionálů jsou v ČR muži. Přilákat více žen dává smysl,,,https://www.moore-czech.cz/tiskove-zpravy/rijen-2021/9-z 10-ict-profesionalu-jsou-v-cr-muzi-prilakat-vi
Odvolávky jako strašák subdodavatelů v autoprůmyslu. Už za čtvrt roku se mohou dostavit existenční problémy,,,https://www.moore-czech.cz/tiskove-zpravy/rijen-2021/odvolavky-jako-strasak-subdodavatelu-v-autoprumysl
,,,https://www.moore-czech.cz/tiskove-zpravy/rijen-2021/erik-durkan-se-stava-novym-partnerem-poradenske-sk
Exkluzivní průzkum: 2/3 firem a podnikatelů neočekávají po zbytek roku omezení ze strany státu,,,https://www.moore-czech.cz/tiskove-zpravy/zari-2021/exkluzivni-pruzkum-2-3-firem-a-podnikatelu-neoceka
Podprůměrný růst HDP ve druhém čtvrtletí. Česká ekonomika se zotavuje pomaleji než naprostá většina zemí EU,,,https://www.moore-czech.cz/tiskove-zpravy/srpen-2021/podprumerny-rust-hdp-ve-druhem-ctvrtleti-ceska-eko
Výkon českého průmyslu byl v červnu nad průměrem EU. Lepší výsledky brzdí nedostatek pracovníků i vstupů.,,,https://www.moore-czech.cz/tiskove-zpravy/srpen-2021/vykon-ceskeho-prumyslu-byl-v cervnu-nad-prumerem-e
Růst českého dluhu v prvním čtvrtletí byl druhý nejvyšší v EU. Více prohloubil zadlužení pouze Kypr,,,https://www.moore-czech.cz/tiskove-zpravy/cervenec-2021/rust-ceskeho-dluhu-v-prvnim-ctvrtleti-byl-druhy-ne
Růst cen hypoték pokračuje. Česko se blíží k deseti zemím EU s nejvyšší průměrnou sazbou,,,https://www.moore-czech.cz/tiskove-zpravy/cervenec-2021/rust-cen-hypotek-pokracuje-cesko-se-blizi-k-deseti
Ukončení Antiviru se do nezaměstnanosti nepromítlo. Programy pomohly zachovat 100 tisíc míst,,,https://www.moore-czech.cz/tiskove-zpravy/cervenec-2021/ukonceni-antiviru-se-do-nezamestnanosti-nepromitlo
Zadlužení ČR nevzrostlo v roce 2020 zásadněji než v ostatních zemích Visegrádské čtyřky,,,https://www.moore-czech.cz/tiskove-zpravy/cervenec-2021/zadluzeni-cr-nevzrostlo-v-roce-2020-zasadneji-nez
Srovnání fiskálních opatření zemí Visegrádské čtyřky: V přepočtu na obyvatele vynaložila Česká republika v boji s covid-19 druhá nejvíce,,,https://www.moore-czech.cz/tiskove-zpravy/cerven-2021/srovnani-fiskalnich-opatreni-zemi-visegradske-ctyr
Datovou schránku nově dostanou další právnické osoby i živnostníci,,,https://www.moore-czech.cz/tiskove-zpravy/cerven-2021/datovou-schranku-nove-dostanou-dalsi-pravnicke-oso
Moore Czech Republic posiluje na poli kybernetické bezpečnosti díky akvizici Menzo Security,,,https://www.moore-czech.cz/tiskove-zpravy/cerven-2021/moore-czech-republic-posiluje-na-poli-kyberneticke
"SKUPINA MOORE CZECH REPUBLIC POSILUJE V OBLASTI AUDITU, KOUPILA SPOLEČNOST ADUKO",,,https://www.moore-czech.cz/tiskove-zpravy/kveten-2021/skupina-moore-czech-republic-posiluje-v-oblasti-au
Novým předsedou představenstva a generálním ředitelem společnosti Servodata se stane Miroslav Řezníček,,,https://www.moore-czech.cz/tiskove-zpravy/kveten-2021/novym-predsedou-predstavenstva-a-generalnim-redite
"V ČERVNU VSTOUPÍ V PLATNOST NOVÝ ZÁKON O EVIDENCI SKUTEČNÝCH MAJITELŮ FIREM, PODNIKATELŮM MOHOU HROZIT SANKCE",,,https://www.moore-czech.cz/tiskove-zpravy/duben-2021/v-cervnu-vstoupi-v-platnost-novy-zakon-o-evidenci
Česká umělá inteligence odhalí dvaapůlkrát více černých odběrů elektřiny než běžné metody. Předpoví i havárie vodovodů a plynovodů,,,https://www.moore-czech.cz/tiskove-zpravy/duben-2021/ceska-umela-inteligence-odhali-dvaapulkrat-vice-ce
"Většina Čechů by čtyřdenní pracovní týden uvítala. Výhody v něm vidí i firmy, nad jeho zavedením ale zatím neuvažují",,,https://www.moore-czech.cz/tiskove-zpravy/brezen-2021/vetsina-cechu-by-ctyrdenni-pracovni-tyden-uvitala
,,,https://www.moore-czech.cz/tiskove-zpravy/brezen-2021/technologicka-spolecnost-servodata-ze-skupiny-moor
"V SEKTORECH NEJVÍCE ZASAŽENÝCH PANDEMIÍ VZROSTE TRANSAKČNÍ AKTIVITA O DESÍTKY PROCENT, PRODEJE FIREM URYCHLÍ I GENERAČNÍ OBMĚNA",,,https://www.moore-czech.cz/tiskove-zpravy/brezen-2021/v-sektorech-nejvice-zasazenych-pandemii-vzroste-tr
"Asijské ekonomiky v ekonomickém růstu předbíhají Evropu, pomohlo jim rychlé zotavení z pandemie",,,https://www.moore-czech.cz/tiskove-zpravy/brezen-2021/asijske-ekonomiky-v-ekonomickem-rustu-predbihaji-e
"Kompenzace pro školicí firmy v programech COVID neodpovídají skutečným ztrátám, hrozící zánik stovek z nich zpomalí restart ekonomiky",,,https://www.moore-czech.cz/tiskove-zpravy/brezen-2021/kompenzace-pro-skolici-firmy-v-programech-covid-ne
"Poradenská skupina Moore Czech Republic vytvořila ucelenou holdingovou strukturu, komplexními službami chce konkurovat „velké čtyřce“",,,https://www.moore-czech.cz/tiskove-zpravy/brezen-2021/poradenska-skupina-moore-czech-republic-vytvorila
DATOVOU SCHRÁNKU BY KVŮLI PROJEDNÁVANÉ NOVELE ZÁKONA MOHLI POVINNĚ DOSTAT VEDLE FIREM TAKÉ DALŠÍ PRÁVNICKÉ OSOBY A ŽIVNOSTNÍCI,,,https://www.moore-czech.cz/tiskove-zpravy/leden-2021/datovou-schranku-by-kvuli-projednavane-novele-zako
VÝROBA AUT BUDE V ROCE 2021 V NEJLEPŠÍM PŘÍPADĚ STAGNOVAT,,,https://www.moore-czech.cz/tiskove-zpravy/leden-2021/vyroba-aut-bude-v-roce-2021-v-nejlepsim-pripade-st
"Bezbariérovost splňuje asi jen desetina pražských sportovišť, pomoci zlepšit situaci má nový plán rozvoje sportu",,,https://www.moore-czech.cz/tiskove-zpravy/prosinec-2020/bezbarierovost-splnuje-asi-jen-desetina-prazskych
,,,https://www.moore-czech.cz/tiskove-zpravy/listopad-2020/skupina-moore-czech-republic-posiluje-auditni-sluz
"Nová petice chce zařadit esport na úroveň klasických sportů, inspiraci našla v Německu",,,https://www.moore-czech.cz/tiskove-zpravy/rijen-2020/nova-petice-chce-zaradit-esport-na-uroven-klasicky
Skupina Moore Czech Republic se rozrůstá o unikátní koncept divize Moore Technology CZ,,,https://www.moore-czech.cz/tiskove-zpravy/rijen-2020/skupina-moore-czech-republic-se-rozrusta-o-unikatn
Na trh účetního a daňového poradenství vstupuje nový silný hráč: Moore Accounting CZ se vidí v TOP 5,,,https://www.moore-czech.cz/tiskove-zpravy/zari-2020/na-trh-ucetniho-a-danoveho-poradenstvi-vstupuje-no
Moore Czech Republic rozšiřuje své služby. Vzniká Moore Legal CZ,,,https://www.moore-czech.cz/tiskove-zpravy/zari-2020/moore-czech-republic-rozsiruje-sve-sluzby-vznika-m
"Komunita českého esportu bude mít za pět let půl milionu osob, v Německu už jde o plnohodnotný sport",,,"https://www.moore-czech.cz/tiskove-zpravy/august-2020/the-czech-esport-community-will-grow-to-500,000-pe"
"Pandemie posílila nutnost připravit úředníky na práci z domova. Vybavení, zabezpečení a proškolení přijde na desítky miliard",,,https://www.moore-czech.cz/tiskove-zpravy/cervenec-2020/pandemie-posilila-nutnost-pripravit-uredniky-na-pr
"Hromadný home office přinesl firmám až třetinové snížení produktivity, problémem je i kyberbezpečnost",,,https://www.moore-czech.cz/tiskove-zpravy/kveten-2020/hromadny-home-office-prinesl-firmam-az-tretinove-s
KYBERBEZPEČNOST,,,https://www.moore-czech.cz/tiskove-zpravy/duben-2020/tiskova-zprava-15-4-2020-kyberbezpecnos
FIREMNÍ DLUHOPISY,,,https://www.moore-czech.cz/tiskove-zpravy/duben-2020/firemni-dluhopisy
,,,https://www.moore-czech.cz/tiskove-zpravy/january-2020/moore-vstupuje-do-cr
